sentenceId,sentence,sentence_time
224,"In the realm of fashion, the designer unveils a collection that tells a story, blending innovation and tradition on the runway of creativity. ",2020-10-19 21:58:10
225, Admiring the dedication of volunteers at a local charity. ,2022-02-05 00:31:00
226," Embracing the beauty in imperfections, finding acceptance in the mosaic of life's unpredictable art. ",2024-12-18 00:49:35
227, Enthusiasm for a DIY home improvement project.       ,2022-04-25 13:13:50
228,"In the audience of a Jay-Z performance, the lyrics of 'Empire State of Mind' become an anthem of pride. ",2021-10-03 12:42:17
229, Quality time with family this weekend.             ,2024-06-11 10:24:03
230,"Celebrating a historic victory in the World Cup, the nation erupts in joy, united by the triumph of their football team. ",2020-11-15 22:38:57
231," Anxiety grips my heart, worry clouds my thoughts.  ",2021-03-26 14:03:22
232,"Enrolled in a dance class for seniors, moving to the rhythm of life. Age is just a number on the dance floor. #DanceClass #SeniorDancer ",2021-12-23 23:07:20
233,"Rediscovered the joy of cooking traditional family recipes. The kitchen, a place of cherished memories. #FamilyRecipes #SeniorCooking ",2024-07-25 08:34:50
234,Witnessed a heated argument in the cafeteria. Unpleasant atmosphere at lunch. ,2022-05-11 23:19:24
235, Confusion reigns as I try to make sense of recent events.,2022-04-30 18:52:00
236,"Exploring the vibrant street art of a cultural neighborhood, each mural tells a story, infusing the city with creativity and expression. ",2023-07-11 16:49:29
237," Leafing through the pages of an old photo album, nostalgia weaving tales of laughter and tears. ",2022-01-19 14:57:44
238,"Surrounded by the vibrant colors of a flower garden, the gardener nurtures blossoms, finding joy in the beauty of nature's ever-changing canvas. ",2023-06-14 02:09:23
239,"In the void of heartache, echoes of a love song play, each note a pang of longing. ",2024-05-11 09:26:06
240,"In the midst of a cycling race, a tire blowout leads to frustration for the cyclist, who valiantly tries to overcome the unexpected obstacle. ",2022-12-12 07:40:27
241,"Participated in a charity run, proving that age is no barrier to supporting meaningful causes. #CharityRun #SeniorRunner ",2021-06-30 20:36:06
242," Curiosity leading me down the rabbit hole of knowledge, a perpetual student in life's classroom. ",2022-06-09 12:26:05
243,Joyful laughter resonates through a lively summer carnival.         ,2025-03-18 09:04:46
244,Reflective contemplation amid the ruins of a forgotten era.        ,2020-07-07 11:45:28
245,"Joined a nature photography club, capturing the beauty of the great outdoors. Every click is a connection to nature. #NaturePhotography #SeniorPhotographer ",2023-12-09 15:36:10
246," Drifting through the day with a nonchalant demeanor, embracing the art of indifference. ",2020-07-20 07:26:30
247, Trying out a new recipe for dinner tonight.        ,2024-07-04 08:46:16
248,Successfully organized a surprise birthday party for a friend. Party planning expert mode: Achieved! ,2022-05-07 00:22:12
249,"Exploring the art of meditation, finding tranquility in the stillness of the mind. #MeditationJourney #TranquilMind ",2022-05-20 19:37:21
250,"At the golf tournament, the golfer's precision and focus lead to a stunning victory, leaving spectators in awe of their exceptional skill. ",2022-03-14 18:16:14
251, Pride in completing a challenging fitness challenge.    ,2021-08-22 22:40:20
252,"Amidst the pages of a captivating mystery novel, the reader unravels clues and secrets, experiencing a thrilling journey of suspense and revelation. ",2020-07-19 02:51:38
253,Heartfelt gratitude for the laughter shared during a family reunion. ,2021-11-08 03:35:10
254,"Sailing the azure waters of the Maldives, each wave a whisper of serenity in paradise. ",2021-04-28 22:23:55
255, Reflecting on the beauty of nature.                ,2024-09-14 01:59:10
256, Coding a new project with enthusiasm.              ,2022-12-26 06:03:13
257," Gazing at the sunset, a melancholic longing for moments that slip through the fingers of time. ",2025-04-10 03:20:28
258, Reverence for the artistry displayed in a museum.      ,2025-03-11 12:59:25
259, Quiet evening with a good book.                    ,2024-01-31 09:17:28
260,Exploring the world of coding. Debugging is an adventure on its own! #CodingJourney #HighSchoolCoder ,2021-09-10 21:49:21
261," A journey into the past, flipping through the pages of an old diary, nostalgia taking the lead. ",2020-09-30 17:54:23
262,"In the carnival of emotions, the rollercoaster of thrill sends the heart on a wild ride. ",2020-08-15 21:09:25
263,Embracing the thrill of speed on a rollercoaster's exhilarating twists. ,2022-02-15 17:45:53
264," Hopeful whispers of wind, carrying the promises of a brighter tomorrow, a symphony of optimism in the air of possibilities. ",2024-09-20 22:42:20
265,Marveling at the kaleidoscope of colors in a vibrant street market. ,2021-04-08 11:26:27
266,Immersed in the enchanting melodies of a street musician's violin. ,2025-01-21 03:00:55
267,Caught up on the latest fashion trends and now planning a shopping spree. #Fashionista #TrendyTeen ,2022-08-19 19:50:01
268,"Embarking on a gondola ride in Venice, each canal reflecting the romance of this timeless city. ",2020-11-01 23:41:16
269, Contentment in the simplicity of a home-cooked meal. ,2022-06-01 18:48:10
270, Sending affectionate vibes to all my followers!          ,2025-06-19 04:26:39
271,"Laughter echoes in the air, a chorus of happiness that lifts the spirit higher. ",2024-07-02 08:26:45
272, Empowerment through learning and personal growth.      ,2025-01-17 18:29:26
273,Attending a school assembly to stay informed about upcoming events and announcements. Staying connected with school activities. ,2024-08-13 00:56:47
274,"At a Justin Bieber concert, the infectious beats of 'Baby' create a dance floor of unbridled enthusiasm. ",2023-05-12 19:38:33
275, Disappointed with the service at a local restaurant.    ,2021-10-03 15:07:21
276, Technology is changing the way we live.            ,2025-04-08 13:39:29
277, Compassion in volunteering for a local charity.       ,2020-11-01 12:50:42
278, Planning a garden makeover for spring.             ,2021-12-16 20:53:31
279,"Exploring the wonders of Ferrari World, the roar of engines creating a symphony of speed. ",2021-02-08 04:32:33
280,Harmony resonates as musicians play a melody of unity and togetherness. ,2023-06-08 07:38:25
281, Regret for decisions that led to a painful present.,2022-12-31 12:14:10
282," Exploring new horizons with the spark of curiosity, an adventurer in the vast landscape of knowledge. ",2025-03-01 00:09:31
283, Can't believe the injustice happening in our society.,2020-08-24 15:57:37
284,Overwhelmed by the support received during a personal challenge.,2023-08-10 03:25:37
285," A playful escapade in the carnival of life, carousel laughter and cotton candy dreams swirling in the joyous atmosphere. ",2024-05-26 01:37:13
286," A heart overflowing with gratitude, a garden where appreciation blooms in the soil of kindness and connection. ",2023-01-11 17:38:20
287,"Nostalgia, a bittersweet dance in the moonlit ballroom of cherished memories. ",2021-11-05 04:33:29
288,"Tears, the currency of grief, spent in the marketplace of lost love and longing. ",2022-11-30 11:16:46
289,Successfully fundraising for a school charity initiative. The joy of giving back to the community! ,2024-11-24 22:54:40
290," Navigating the river of contentment, a serene boat cruise through the tranquil waters of inner peace and acceptance. ",2022-02-22 07:57:57
291," Revisiting old photographs, caught in the embrace of nostalgia's bittersweet symphony. ",2023-12-27 00:01:15
292, Reverence for the wonders of nature on a hiking trail.,2021-04-13 19:59:26
293,"In the golf tournament, a missed crucial putt results in defeat, causing the golfer to reflect on the pressure of high-stakes competition. ",2020-10-31 04:58:18
294,Radiant joy akin to blossoming flowers on a sunlit spring morning. ,2024-09-07 19:59:24
295,"In the dance of positivity, every step is a rhythm, uplifting the soul in harmony. ",2022-12-14 01:12:50
296, Excitement for a weekend road trip to explore new places. ,2020-10-07 06:11:13
297,"Connecting with the melody of a live orchestra, the music enthusiast experiences a symphony that resonates deep within the soul. ",2025-05-26 15:08:17
298,Awe-inspired by the grandeur of an ancient cathedral's intricate architecture. ,2025-03-08 02:00:12
299, Traffic was terrible this morning.                 ,2021-12-09 17:33:02
300,Trying out a new smoothie recipe for a healthy start to the week. Smoothie enthusiast: Level up! ,2022-10-23 05:27:25
301,"Embarking on a spontaneous road trip, the traveler discovers hidden gems, creating memories that will be cherished for a lifetime. ",2025-05-19 21:58:48
302, Overflowing happiness: welcoming a new family member!  ,2023-05-14 10:12:58
303," Serenity found in the stillness of nature, a tranquil retreat from the chaos of the modern world. ",2023-03-02 14:48:24
304, Winter sports day at the local park.               ,2022-01-09 11:22:25
305,"In the tranquility of Kyoto's bamboo forest, whispers of ancient Zen wisdom echo through the groves. ",2023-07-14 18:37:17
306,"Haunted by regrets, the ghost of the past lingers relentlessly.   ",2024-09-08 14:57:09
307,"In the garden of broken dreams, petals fall, a silent testimony to shattered hopes. ",2022-01-29 22:25:31
308,Pride in achieving a personal milestone in career progression.   ,2020-07-31 06:35:04
309, Overflowing adoration for a cute rescue puppy! 🐶       ,2021-11-25 15:51:10
310,"Reflecting on life's journey, grateful for the lessons learned. ",2023-07-27 04:29:30
311,"In the world of science, a breakthrough discovery unfolds, pushing the boundaries of knowledge and opening new frontiers of exploration. ",2023-03-10 14:43:07
312,Motivated to achieve fitness goals after an invigorating workout.  ,2021-09-30 03:50:32
313," Ambivalence in the air, caught between the crossroads of conflicting emotions and decisions. ",2025-03-26 02:44:26
314," New year, new fitness goals! 💪                    ",2025-01-03 14:57:13
315," Frustrated attempts to mend a broken connection, the threads of understanding slipping through the fingers like grains of sand. ",2023-02-04 01:12:29
316,"Spent the afternoon at a museum, pretending to be cultured. Art enthusiast in the making. #MuseumDay #TeenArtLover ",2022-01-25 23:15:53
317,"Embarking on a culinary adventure, savoring exotic flavors around the world. ",2022-04-02 20:19:00
318," Confident strides in the dance of life, a ballroom where self-assuredness leads, twirling through challenges with grace. ",2024-12-19 09:51:40
319, Jealousy consumes me as I witness others' success. ,2022-02-01 17:02:32
320,Participating in a school-wide art exhibition. Witnessing creativity and spreading positive vibes! ,2024-07-26 23:33:13
321,"Daydreaming about the upcoming prom. The dress, the dance – it's a fairytale in the making! ",2023-09-25 12:32:48
322,"Lost in the maze of curiosity, each twist and turn unveils the treasures of discovery. ",2022-01-29 10:26:41
323,Attending a workshop on time management to enhance organizational skills. Striving for efficiency. ,2024-11-26 12:02:55
324,"Walking the Great Wall of China, each step a testament to ancient engineering marvels. ",2023-03-14 10:25:00
325," Determination ablaze, forging a path through challenges, sculpting dreams into tangible realities. ",2024-11-23 16:00:45
326,"Embracing the aroma of freshly baked bread, the home chef finds joy in the art of baking, creating delicious memories for loved ones. ",2022-05-13 08:36:22
327,"Amidst the bustling city, a quiet café becomes a sanctuary for reflection, where a cup of coffee brings solace to the wandering mind. ",2021-11-11 03:14:03
328,Feeling down after not making the sports team. Disappointment lingers. ,2021-04-03 07:30:39
329," Sinking in despair, each day darker than the last. ",2023-04-13 12:14:48
330,"Basking in the glow of accomplishment, each milestone a stepping stone to happiness. ",2023-03-07 13:57:08
331,Accidentally walked into the wrong classroom on the first day. Classroom mix-up: Awkward start! ,2023-08-17 09:51:42
332,"At the front row of Adele's concert, each note of 'Someone Like You' resonates with soul-stirring emotion. ",2024-05-24 15:55:02
333, Sharing love and positive vibes with everyone! ❤️      ,2024-12-26 21:50:12
334,"Serenading the stars with a heart full of gratitude, a melody of thankfulness. ",2021-05-31 15:35:25
335,"In the serene beauty of a sunset, nature unfolds a canvas of colors, evoking a sense of tranquility and wonder. ",2020-10-18 01:50:22
336," Extending a hand, empathetic threads weaving a tapestry of understanding, embracing the joys and sorrows of others. ",2022-08-13 17:23:33
337, Exploring the world of virtual reality.            ,2022-02-16 07:56:10
338," Jealousy, a venom that seeps through the veins, poisoning the heart and turning it into a breeding ground for discontent. ",2022-11-21 16:11:42
339,"Like a withered rose in the garden of love, petals fall, a silent surrender to time. ",2022-04-27 03:34:38
340, Fulfillment in completing a challenging puzzle.      ,2021-10-01 16:31:55
341," Whispering tales of inspiration to the stars, a storyteller crafting constellations from the threads of imagination. ",2025-05-26 03:29:32
342," Loneliness echoes in empty spaces, yearning for connection.",2023-03-16 21:26:52
343,Savoring the warmth of a cup of cocoa on a chilly winter evening.   ,2023-09-17 05:13:26
344,Inspired by the resilience of a lone tree standing tall in a storm. ,2021-12-22 04:18:45
345,"Lost in the enchantment of Disneyland, each ride a journey into the realm of childhood fantasies. ",2024-02-15 10:03:35
346,Overjoyed by the warmth of a cozy fireplace on a winter evening.   ,2024-10-16 19:31:26
347," Shattered dreams lie on the floor like fragments of glass, a mosaic of disappointment crafted by the hands of frustration. ",2021-03-06 21:49:43
348,Tried to impress my crush with a smooth conversation. Ended up spilling my drink. Smooth level: Nonexistent! ,2025-04-27 07:29:06
349, Tenderness in the warmth of a cozy winter evening.     ,2024-05-31 01:12:37
350,Trying to set a new trend by juggling textbooks between classes. Academic juggling: A unique skill! ,2023-01-21 22:31:59
351, A moment of shame for not speaking up against injustice.,2023-12-13 22:54:15
352,Giggles and joy echo in the air during a children's playdate.      ,2021-03-11 20:29:13
353, Awe-struck by the beauty of the night sky.               ,2020-09-04 20:37:51
354,"In the tapestry of despair, threads of hope unravel, leaving a portrait of sorrow. ",2023-08-11 23:31:36
355," Shattered dreams lie on the floor like fragments of glass, a mosaic of disappointment crafted by the hands of frustration. ",2023-11-18 22:07:19
356," Determination burning like a wildfire, overcoming obstacles, turning dreams into reality. ",2024-01-29 08:50:52
357,"Swept away by the river of regret, the currents of the past refusing to release. ",2020-08-26 06:34:26
358, Reverence for the beauty of a historic landmark.       ,2023-01-09 14:44:45
359,"Sipping on a favorite vintage wine, each sip telling a story of the years gone by. Cheers to a life well-lived. #WineLover #VintageCheers ",2020-09-13 20:21:36
360, Sipping coffee and enjoying a good book.           ,2022-08-25 13:43:50
361,Feeling a sense of despair after a major project failure. Hard work didn't pay off this time. ,2023-05-07 17:34:06
362, Confusion clouds my mind as I navigate through decisions.,2020-08-29 19:59:08
363, Kindness witnessed today restores my faith in humanity.  ,2020-09-27 20:42:42
364," With empathy as a lantern, wandering through the dark alleys of sorrow, illuminating the path with compassion and care. ",2021-02-25 08:43:09
365,"Emotional exhaustion, the weight of the world crushing weary shoulders. ",2022-09-02 12:15:31
366, Feeling bitter about the unfairness in the workplace.   ,2023-11-07 02:03:49
