sentenceId,sentence,sentence_time
1,Danced in the rain to celebrate the end of exams. Rain dance: Unexpectedly refreshing! ,2024-12-01 12:37:36
2," Loneliness, a solitary moon in a starless sky, casting a cold glow on the landscape of isolation, where echoes bounce in empty spaces. ",2023-08-29 23:49:35
3, Winter blues got me feeling low.                   ,2023-01-04 20:28:24
4, Helplessness sinks in as challenges pile up.       ,2022-03-18 23:47:13
5,Spent hours creating the perfect playlist for every mood. Music is my therapy. #PlaylistMaker #TeenMusicLover ,2021-11-16 15:08:40
6," Overwhelmed by the cacophony of expectations, a drowning soul in the tempest of pressure, struggling to stay afloat. ",2020-08-03 09:23:13
7,Building a time capsule to capture memories for the future. Time-traveling emotions! ,2021-04-24 10:54:52
8, Exploring the city's hidden gems.                  ,2025-03-10 03:39:10
9," Frustrated fingers tapping on the keyboard, a symphony of annoyance composing an unsolvable puzzle of unmet expectations. ",2021-01-20 15:51:25
10,Captivated by the serenity of a tranquil garden in full bloom.     ,2022-11-03 13:08:12
11, Sunday brunch with friends.                        ,2021-06-02 23:44:40
12,"Cheering for the underdog in the basketball finals, the crowd erupts in applause as the team defies odds to claim the championship title. ",2022-11-28 19:59:42
13," Boredom sets in, the day feels endlessly dull.     ",2022-10-16 11:02:58
14, Trying out a new dessert recipe.                   ,2023-10-14 18:16:06
15,"Sinking like autumn leaves in the river of sorrow, carried away by the current. ",2022-07-15 22:48:08
16," Fueled by curiosity, venturing into uncharted realms, a fearless explorer of the mysteries of the world. ",2020-12-09 08:31:33
17," Wandering through the desert of loneliness, each step a heavy sigh, mirages of connection shimmering but never materializing. ",2022-11-02 17:52:10
18,"Like a comet of inspiration, streaking through the sky of creativity, leaving trails of brilliance. ",2023-07-23 12:34:54
19," Bathed in the golden hues of gratefulness, a sunset of appreciation casting its warm glow on the landscapes of the heart. ",2023-03-05 19:39:06
20,"The weightlifter's failed attempt at a personal record results in frustration, highlighting the challenging nature of pushing physical limits. ",2022-07-17 06:43:24
21, Hopeful about the potential for personal growth.      ,2021-12-15 21:07:27
22, Gratitude for the support received during tough times. ,2023-01-04 10:33:33
23,"Attended a local jazz festival, tapping toes to the tunes that have stood the test of time. Music, a lifelong love affair. #JazzFestival #SeniorMusicLover ",2022-04-28 21:55:42
24,Curiosity sparked by exploring a mysterious ancient ruin.      ,2023-08-02 22:14:56
25," Confident strides in the dance of life, a ballroom where self-assuredness leads, twirling through challenges with grace. ",2025-02-14 17:09:19
26, Overflowing with gratitude for life's blessings.      ,2024-12-23 13:12:09
27,"Experiencing the magic of a Coldplay concert, where 'Fix You' becomes a beacon of hope in the night. ",2020-11-22 08:29:25
28, Envy eats away at me as I see others' prosperity.  ,2021-01-18 06:57:37
29,Confidence soars after overcoming public speaking anxiety.       ,2024-01-10 05:21:28
30,"In the crowd of an Ariana Grande concert, the high notes of 'Into You' create a euphoric symphony. ",2020-07-05 23:34:56
31, Laughter is the best medicine—enjoying a comedy show. ,2022-11-11 14:54:47
32,Caught in a torrential rainstorm without an umbrella. Today's weather is just bad luck. ,2023-05-31 22:45:56
33," Torn between opposing emotions, an ambivalence that colors my decisions with shades of uncertainty. ",2024-08-03 00:49:58
34," Embraced by the hopeful dawn, a gardener sowing seeds of optimism, tending to the blooms of a brighter tomorrow. ",2020-07-13 21:55:15
35, Late-night gaming session with friends.            ,2024-11-18 16:17:14
36,"Visited an art gallery, appreciating the brushstrokes that tell tales of creativity. Art, an eternal companion. #ArtGallery #SeniorArtLover ",2022-09-05 04:53:14
37," Fearful eyes scanning the shadows, a prisoner of the night, terrorized by the lurking monsters born from the mind's darkest corners. ",2024-01-18 21:19:03
38," Soaring on the wings of a free spirit, unburdened by the chains of conformity, painting the sky with independence. ",2023-12-17 02:52:11
39,"Whispers of lost love linger in the attic of the heart, forgotten but not erased. ",2025-03-22 23:09:22
40,Experiencing hate comments for expressing personal opinions. Online negativity prevails. ,2022-09-10 22:41:18
41," Grief overwhelms, a storm of emotions within.      ",2020-09-24 22:57:07
42,"Joined the school debate team. Words are my weapons, and I'm ready for battle! ",2022-08-15 13:32:27
43,Missing an important event due to unforeseen circumstances. A day filled with sadness. ,2023-09-23 21:57:22
44,"Participated in a local theater production, proving that the stage belongs to every age. #TheaterProduction #SeniorActor ",2024-08-22 06:47:44
45, Finding calmness amidst the chaos of daily life.        ,2022-07-13 01:55:06
46," Resentment festers, poisoning relationships.       ",2021-11-28 11:51:34
47," Apprehensive steps on the tightrope of uncertainty, a balancing act where the fall seems inevitable, anxiety a constant companion. ",2024-07-02 08:24:49
48,"Draped in the warmth of kindness, a quilt of compassion stitched with love. ",2024-02-03 09:51:50
49,"Binge-watching a thrilling crime series, the suspense keeps the viewer on the edge of their seat, creating a rush of adrenaline. ",2020-08-30 00:40:55
50,"In the midst of a soccer match, an unexpected own goal creates a moment of despair for the player, as teammates console and encourage them. ",2021-05-26 17:27:02
51,Dealing with a personal setback. Sometimes life throws unexpected challenges. ,2020-07-13 03:14:53
52,"Started a photography club at school. Capturing moments, one snapshot at a time! ",2022-03-12 07:00:26
53,"In the embrace of love, each heartbeat is a melody, dancing to the rhythm of affection. ",2022-08-18 07:09:52
54, Feeling grateful for the little things in life.    ,2024-05-19 19:28:49
55,Participating in a debate club to enhance critical thinking and communication skills. Intellectual engagement in progress. ,2022-10-15 08:45:43
56, New book release from my favorite author!          ,2021-09-06 19:33:16
57,"Tears, the ink staining the pages of a journal, a testament to silent grief. ",2024-04-06 13:35:05
58,"Facing a defeat in the championship, the boxer reflects on the challenges, vowing to return stronger and more determined in the next bout. ",2024-10-02 11:20:42
59, Intimidation by the unknown future ahead.          ,2024-10-28 04:56:36
60, Just adopted a cute furry friend! 🐾              ,2020-07-15 19:57:04
61, Cooking a special dinner for loved ones.           ,2022-12-22 08:23:42
62,Experimenting with a new recipe for a school bake sale. Baking adventures in the kitchen. ,2023-11-01 13:49:25
63,Perfecting the art of creating origami during a dull lecture. Origami mastery: A+! ,2021-03-09 09:16:05
64, Excited about the upcoming weekend getaway!        ,2022-08-20 21:04:51
65,"Skiing down the slopes of the Swiss Alps, each turn a dance with the majesty of snow-capped peaks. ",2021-04-17 09:57:14
66,"In the symphony of grief, each tear is a note, composing a melancholic melody. ",2022-03-09 17:22:26
67," Envious gazes cast upon the podium of success, a bitter pill swallowed, the taste lingering as a constant reminder of unattained heights. ",2020-08-26 17:30:15
68,Practicing a stand-up comedy routine for the upcoming talent show. Comedy gig: In the making! ,2024-08-08 07:48:51
69," Navigating the river of contentment, a serene boat cruise through the tranquil waters of inner peace and acceptance. ",2021-02-22 05:34:58
70, Excitement building up for a surprise birthday party.   ,2022-10-31 21:08:02
71," A free spirit soaring on the wings of dreams, leaving trails of independence in the azure sky of boundless possibilities. ",2025-06-19 09:52:22
72,"Captivated by the spellbinding plot twists, the audience applauds, experiencing a rollercoaster of emotions at the movie premiere. ",2022-08-28 04:46:55
73," Basking in the serenity of a quiet forest, where the whispers of nature bring peace to the soul. ",2022-05-19 23:14:36
74, Learning a new language for personal growth.       ,2022-12-01 07:50:06
75,"Reflecting on a lifetime of memories, each wrinkle tells a story. Embracing the beauty of aging. #LifeReflections #BeautyInAging ",2024-03-10 04:22:52
76," With a zestful heart, sprinting through fields of enthusiasm, chasing sunbeams and laughter in the meadows of joy. ",2024-11-07 12:37:48
77,"Darkness descends, engulfing the soul in the shadows of despair.  ",2020-08-26 10:08:25
78, Starting a new fitness challenge tomorrow! 💪     ,2023-12-08 18:00:02
79,Wonderment at the beauty of a double rainbow after the rain.     ,2024-01-09 04:28:46
80," Melancholy painting the world in hues of nostalgia, a canvas of bittersweet memories. ",2022-11-14 07:48:15
81, Practicing mindfulness with meditation.            ,2024-08-20 16:50:39
82, Tenderness in a quiet moment shared with a pet.      ,2023-03-07 04:36:37
83," Lost in the labyrinth of thoughts, confusion casting shadows on the quest for clarity. ",2020-08-06 01:20:40
84,Having a string of bad luck with constant technology malfunctions. Tech troubles galore! ,2024-01-28 10:14:07
85,Chasing dreams like a kite soaring high in the vast open sky.      ,2020-09-18 00:17:08
86,Mesmerized by the cosmic dance of fireflies on a moonlit night.    ,2022-03-13 07:09:43
87,"In the labyrinth of grief, the walls echo with the footsteps of lost joy. ",2021-11-27 02:12:12
88, Disgust at the sight of injustice and cruelty.     ,2023-11-15 06:15:16
89,"Joined a writing group, penning down thoughts and reflections. Writing, a journey into the depths of the soul. #WritingGroup #SeniorWriter ",2024-02-13 05:43:15
90, Hopeful about the possibilities of a new journey.      ,2021-06-16 13:26:00
91,Successfully cooked a gourmet meal for the family. Chef skills unlocked! #ChefMode #TeenChef ,2023-04-03 20:29:44
92," Frustration escalates, a thunderstorm of emotions. ",2022-07-19 17:16:43
93,"Attended a vintage car show, reminiscing about the classics that once ruled the roads. Nostalgia in every rev. #VintageCars #ClassicRides ",2025-06-22 00:26:15
94,"Embarked on a hiking adventure, conquering trails and relishing the beauty of nature. Age is just a number on the mountaintop. #HikingAdventure #SeniorHiker ",2021-12-05 01:59:33
95,Accidentally liked my crush's old photo while stalking their profile. Awkward level: Maximum! ,2024-09-19 20:01:30
96,"Joined a seniors' cycling club, feeling the wind in my hair and the freedom of the open road. #CyclingClub #SeniorCyclist ",2023-08-01 17:09:18
97,"Captivated by the historical charm of the Colosseum, each stone echoing tales of gladiator valor. ",2021-08-12 07:39:23
98,Sharing favorite book recommendations with classmates. Building a mini book club. ,2024-12-15 05:52:16
99,"Reconnecting with old friends over a cup of tea. Friendship, the true essence of companionship. #OldFriends #Companionship ",2021-12-13 11:29:46
100,"Hosted a picnic in the park, basking in the warmth of friendship and sunshine. Simple joys, timeless memories. #ParkPicnic #SeniorJoy ",2024-04-08 22:06:04
101, Overflowing with adoration for my adorable pet! 🐾      ,2021-07-29 13:46:16
102,"Wandering through the historical streets of Kyoto, each step a journey into the heart of Japan's traditions. ",2021-07-28 14:21:14
103, Frustration mounts as obstacles block my path.     ,2024-06-30 13:52:00
104,"The bitterness of betrayal, a taste that lingers, staining the palate of trust. ",2022-11-13 16:11:51
105,"In the heart of New York City, Times Square dazzles with lights, a vibrant spectacle of urban energy. ",2024-06-26 02:36:04
106, Elation after a surprise reunion with a childhood friend.,2022-06-09 02:09:12
107," Loneliness, a silent companion in the night, the only echo in the chamber of solitude, a heart's solitary nocturne. ",2020-12-13 18:22:23
108," Resentment festers, a wound that refuses to heal.  ",2021-01-18 05:31:10
109,"Immersed in the soulful melodies of Adele, tears flow freely, moved by the emotion of 'Hello'. ",2020-08-18 11:34:37
110,Optimism for a bright future amidst challenging times.           ,2024-04-06 10:43:13
111,Rejuvenated by the salty breeze and the sound of waves at the seaside. ,2022-06-23 10:52:52
112,"Spent hours on a TikTok dance, only to realize I have two left feet. Dance fail: Unleashed! ",2023-10-31 15:27:13
113,"Swaying to the reggae vibes of Bob Marley's tribute concert, each chord a journey to Jamaica's soul. ",2025-03-11 08:49:41
114, Serenity found in the beauty of a sunset by the sea.  ,2022-09-11 20:38:07
115,"In the midst of the Amazon rainforest, a symphony of wildlife creates an orchestra of nature's wonders. ",2023-10-11 09:36:09
116,"In the spotlight at a Lady Gaga show, each costume change is a metamorphosis of creativity and artistry. ",2024-03-28 20:04:00
117," Embracing the beauty of nature, a moment of contentment. ",2022-06-06 00:22:39
118," Indifferent to the noise of the world, a silent observer in the midst of life's cacophony. ",2021-09-21 07:22:12
119,"In the crowd of a Taylor Swift concert, the lyrics of 'Love Story' create an enchanting fairy tale. ",2023-11-03 15:57:29
120,Decided to study for exams but ended up making memes about studying instead. Procrastination level: Expert. #ProcrastinationNation #TeenConfessions ,2023-12-02 07:48:45
121, Calmness prevails as I practice mindfulness.            ,2022-01-12 07:40:12
122,Numbness sets in as the weight of loneliness grows heavier.       ,2021-03-30 19:45:38
123,Awash with serenity as the sun sets over a tranquil lakeside retreat. ,2022-12-25 13:32:56
124,"In the heart of a bustling market, the street food connoisseur indulges in a culinary adventure, savoring diverse flavors and aromas. ",2021-07-16 20:48:08
125,"The gymnast's unexpected fall during a routine sparks a wave of sympathy from the audience, highlighting the vulnerability of sports. ",2024-10-29 12:09:43
126, Pride in achieving a personal milestone.               ,2024-02-29 12:26:01
127, Empowered to make a difference in my community.        ,2022-11-19 05:43:51
128,"Embarking on a culinary odyssey, savoring flavors around the world. ",2021-07-18 02:39:38
129,Organizing a community cleanup event for a cleaner neighborhood. Promoting environmental awareness. ,2023-08-31 08:48:14
130, Enthusiastically diving into a new project.            ,2021-02-17 23:54:08
131, Feeling a sense of fear after watching a thriller movie. ,2024-04-11 22:40:22
132, Contentment in the embrace of a loved one.           ,2020-12-15 02:33:29
133,Rejuvenated by the salty breeze and the sound of waves at the seaside. ,2023-09-11 18:52:58
134,Received a not-so-great grade on a major project. Academic frustration setting in. ,2024-03-30 01:34:49
135," Floating through the day with an air of indifference, detached from the mundane happenings around. ",2022-05-19 18:26:53
136,"Rocking out to the guitar solos at a Queen tribute concert, a journey back in time with Freddie's spirit. ",2023-11-30 14:28:16
137,"Dancing to Shakira's rhythmic beats, hips swaying to the hypnotic charm of 'Hips Don't Lie'. ",2024-12-07 00:23:58
138,"Embarking on a journey of writing a memoir, documenting a lifetime of experiences. Every story matters. #MemoirWriting #SeniorStories ",2021-03-20 21:44:45
139,Crafting intricate friendship bracelets for the whole squad. Friendship level: Expert weaver! ,2025-03-03 03:04:07
140, Political discussions heating up on the timeline.  ,2021-06-20 19:05:14
141,"Embarked on a road trip to revisit cherished places from the past. Nostalgia, the ultimate travel companion. #RoadTrip #NostalgiaTour ",2024-09-03 09:37:26
142,"Exploring the ancient ruins of Angkor Wat, each stone whispering stories of Khmer civilization. ",2024-04-27 02:09:20
143,Hosted a photography exhibition featuring snapshots of a life well-lived. Every photo has a story to tell. #PhotographyExhibition #SeniorPhotographer ,2025-04-02 06:14:21
144, Attending a live music concert tonight.            ,2021-02-24 10:59:41
145,"In the labyrinth of despair, the echoes of a broken heart reverberate endlessly. ",2023-02-18 14:00:10
146, Serenity found in the melody of a peaceful piano.    ,2023-04-04 00:50:37
147," Compassionate clouds, heavy with care, showering empathy on the parched grounds of human suffering. ",2023-11-28 05:29:30
148," Jealousy, a green-eyed monster, lurking in the shadows, casting a dark cloud over the sunshine of others' success. ",2025-05-01 06:41:21
149,Savoring the flavors of a home-cooked meal. Simple joys are the heart of happiness. #HomeCooking #SimpleJoys ,2023-11-18 04:33:49
150,"Rocking out at a Guns N' Roses show, the iconic riffs of 'Sweet Child o' Mine' echoing in the night. ",2022-03-28 08:58:44
151,"At the Oscars, the actor graciously accepts an award, radiating joy and gratitude for the recognition of their outstanding performance. ",2021-11-18 03:31:17
152," Gratitude as a guiding star, navigating the constellation of blessings in the vast universe of life's precious moments. ",2022-04-25 10:34:39
153," Bitterness festering like a venomous vine, entwining the soul in a web of resentment, poisoning the garden of peace. ",2022-12-20 03:58:47
154,"Lost in the pages of a captivating novel, transported to another world. ",2025-03-17 11:59:00
155, The euphoria of a successful product launch.         ,2023-06-18 05:11:15
156,Successfully avoided eye contact with my crush in the hallway. Mission accomplished. #TeenCrush #StealthMode ,2022-01-13 21:53:29
157,Trying to master the perfect kickflip on my skateboard. Skating into the weekend like a pro! ,2023-02-13 23:25:06
158,"A symphony of laughter, each note a key to unlocking the door of boundless happiness. ",2025-02-18 14:23:09
159, Feeling a sense of fulfillment after helping others. ,2020-08-06 12:19:00
160, Enthusiasm for a new artistic project in the works.  ,2024-01-20 13:01:03
161,"Discovering a hidden gem in the world of documentaries, the viewer is enlightened and inspired, feeling a renewed sense of curiosity. ",2022-08-17 13:50:30
162,Attempting to beat the record for the most consecutive cartwheels. Cartwheel challenge: Underway! ,2022-07-06 22:19:02
163,"Witnessing a heartwarming comeback in the hockey finals, fans share tears of joy as the team secures a historic victory after adversity. ",2023-03-24 22:06:37
164,Amused by the antics of playful kittens during playtime.           ,2021-04-14 12:24:05
165,"Betrayal, a venomous serpent slithering through the garden of trust, poisoning roots. ",2024-11-15 02:20:17
166," Jealousy, a festering wound, the pain intensifying with each glance at the garden of others' achievements, blooming beyond the fence. ",2023-12-22 08:44:03
167," Envy poisons my thoughts, coveting others' success.",2023-09-08 23:22:43
168, The euphoria of a live music concert under the stars.  ,2023-02-27 12:26:21
169,"Embarked on a solo travel adventure, discovering the beauty of new places at my own pace. #SoloTravel #SeniorExplorer ",2024-09-30 14:53:33
170, Compassion shown through acts of kindness in the community.,2023-05-04 18:57:32
171,Facing rejection from a dream college. Disheartened but determined to explore other paths. ,2020-08-21 15:40:02
172," Lost in the vast sea of information, an indifferent wave in the digital ocean. ",2024-07-24 23:30:05
173," Proudly scaling the peaks of achievement, a mountaineer conquering challenges and planting the flag of success. ",2024-05-16 18:24:22
174," Proudly scaling the peaks of achievement, a mountaineer conquering challenges and planting the flag of success. ",2022-04-09 03:37:59
175,A burst of artistic creativity in the quietude of an artist's studio. ,2023-04-02 00:17:23
176, Elation after a surprise reunion with old friends.    ,2024-09-20 21:15:12
177," Anxiety grips my chest, a relentless grip on my thoughts.",2023-12-16 10:56:21
178," Torn between conflicting emotions, an ambivalence that paints my decisions in shades of uncertainty. ",2021-06-10 01:26:57
179,"Desperation whispers, the silent plea for a glimmer of hope in the abyss. ",2021-03-14 02:34:00
180,"Wrapped in the cloak of emotional numbness, a shield against the storms of life's turbulence. ",2023-11-08 00:18:18
181,Drenched in nostalgia while flipping through an old family photo album. ,2023-05-09 14:28:02
182,"Accidentally spilled paint in art class. Abstract art, right? #ArtClassAdventures #HighSchoolArtist ",2025-02-05 00:04:47
183, Compassion towards those in need during the holidays.  ,2023-11-18 17:20:50
184,Awe-inspired by the vastness of the cosmos on a stargazing night.   ,2024-01-06 06:10:49
185,"Engulfed in the aroma of freshly brewed coffee, the writer finds inspiration in every sip, embarking on a journey of creativity and prose. ",2024-05-01 14:36:00
186,"In the realm of literature, a captivating novel transports the reader to distant lands, weaving a tapestry of imagination and escape. ",2023-02-09 03:17:30
187," Immersed in a state of emotional numbness, a shield against the storm of daily struggles. ",2023-04-17 22:54:06
188,Hiding a snack stash in my backpack for emergency cravings. Snack ninja mode: Activated! ,2024-06-15 02:21:28
189,"Staring at the clock in class, waiting for the bell to ring like it's the most exciting event of the day. #ClassCountdown #TeenLife ",2022-12-03 02:14:09
190,Accidentally sent a text meant for a friend to the class group chat. Texting fail: Oops moment! ,2023-12-11 19:27:19
191,Started a blog about random thoughts and musings. Blogging is the new diary. #BloggerLife #TeenBlogger ,2025-04-24 04:23:10
192,Heartfelt gratitude for the laughter shared during a family reunion. ,2022-04-08 18:53:04
193,Collaborating on a school project with peers. Teamwork makes the dream work. ,2023-10-19 10:10:25
194,"Cruising the fjords of Norway, each icy landscape a breathtaking masterpiece of nature's grandeur. ",2025-03-07 04:01:19
195," A playful escapade in the carnival of life, carousel laughter and cotton candy dreams swirling in the joyous atmosphere. ",2022-12-25 21:21:34
196,"Avoiding the thorns of regret, walking barefoot on the path of remorse. ",2021-12-11 15:44:39
197,"Journeying through the serenity of Santorini, where each sunset paints the sky with hues of tranquility. ",2024-02-16 16:41:19
198," Meditating by the serene lake, finding inner peace.   ",2020-12-26 21:41:51
199," Embracing imperfections, finding acceptance in the mosaic of life's beautiful chaos. ",2022-09-28 22:34:27
200,"Organized a community painting event, turning blank canvases into a masterpiece of shared creativity. #PaintingEvent #SeniorArtist ",2024-08-09 04:01:14
201,Enveloped in serenity while practicing mindfulness by the lake.    ,2020-09-24 17:04:25
202," Determination as the driving force, propelling me forward on the path to extraordinary achievements. ",2024-10-21 00:50:35
203,"Discovered a new book series and spent the whole night reading. Who needs sleep, anyway? #BookwormLife #LateNightReading ",2025-02-14 11:03:16
204," Dismissive gestures, a curtain drawn to shield the vulnerability, a stage where emotions take a backseat to the performance of indifference. ",2021-08-02 15:28:42
205,Curiosity awakened by the mysteries of an ancient archaeological site. ,2022-05-31 02:28:59
206,"Joined the drama club to unleash my inner actor. Lights, camera, action! ",2022-09-23 11:16:20
207,Appreciation for the vibrant culture experienced during travel.   ,2022-07-14 19:42:44
208," Striding with confidence, footprints of self-assuredness imprinted on the sands of challenges conquered and victories claimed. ",2021-05-27 23:55:38
209," Floating on clouds of inspiration, an artist painting the sky with strokes of creativity, creating a masterpiece of dreams. ",2025-03-24 05:56:34
210,Whimsical delight in a world of fairy tales and magical creatures.  ,2022-09-16 10:16:35
211,Whispers of inspiration from the rustling leaves in a serene forest. ,2024-02-05 22:02:30
212," A fiery determination burning within, fueled by the vision of reaching unparalleled heights. ",2022-06-18 15:49:56
213,Dealing with unfounded rumors circulating about personal life. Rumors can be hurtful. ,2024-04-14 15:31:27
214,Attended a concert and danced the night away. Music is the heartbeat of life. #ConcertVibes #DanceAllNight ,2024-02-18 06:00:08
215,"In the garden of contentment, each bloom whispers tales of inner peace and joy. ",2022-12-15 09:01:24
216,Feeling empowered after conquering a challenging hiking trail.     ,2024-01-10 20:23:40
217,"At the summit of Mount Fuji, a breathtaking sunrise that paints the sky with hues of accomplishment. ",2020-12-22 03:34:35
218,Attending a school talent show to support classmates. Applauding the diverse talents on display! ,2020-07-11 09:19:29
219,Attempting to impress the teacher with an elaborate science experiment. Science geek mode: Activated! ,2021-05-15 05:50:10
220,Hosting a sleepover with friends this weekend. Preparing for a night of laughter and memories! ,2022-12-28 02:34:41
221,"Started a community garden, growing not just plants but friendships too. Green thumbs unite! #CommunityGarden #SeniorGardener ",2025-01-31 19:29:04
222,"Attended a lecture on history, always fascinated by the lessons from the past. Learning is a lifelong adventure. #HistoryLecture #SeniorLearning ",2023-07-12 02:32:33
223,"Experiencing a series of losses in the basketball season, the team grapples with frustration, determined to turn the tide with renewed effort. ",2020-11-10 18:14:10
